{
  "claim_level": "synthetic_benchmark",
  "data_provenance": "synthetic",
  "drivers": [
    {
      "accessibility_training": true,
      "availability": true,
      "depot_id": "Z_DEPOT_1",
      "id": "3fad44e0-fc24-565c-8e18-c31381627694",
      "language_capabilities": [
        "ru"
      ],
      "qualifications": [
        "passenger",
        "accessibility"
      ],
      "shift_end": 720,
      "shift_start": 0
    },
    {
      "accessibility_training": true,
      "availability": true,
      "depot_id": "Z_DEPOT_2",
      "id": "a3440454-8661-55dc-a1ba-6a2c746b853a",
      "language_capabilities": [
        "ru"
      ],
      "qualifications": [
        "passenger",
        "accessibility"
      ],
      "shift_end": 720,
      "shift_start": 0
    },
    {
      "accessibility_training": true,
      "availability": true,
      "depot_id": "Z_DEPOT_1",
      "id": "ab5a593b-d7da-5f8b-a100-905490f9047b",
      "language_capabilities": [
        "ru"
      ],
      "qualifications": [
        "passenger",
        "accessibility"
      ],
      "shift_end": 720,
      "shift_start": 0
    },
    {
      "accessibility_training": true,
      "availability": true,
      "depot_id": "Z_DEPOT_1",
      "id": "cb910898-1d92-5c39-b37c-3daef3a2f193",
      "language_capabilities": [
        "ru"
      ],
      "qualifications": [
        "passenger",
        "accessibility"
      ],
      "shift_end": 720,
      "shift_start": 0
    },
    {
      "accessibility_training": true,
      "availability": true,
      "depot_id": "Z_DEPOT_2",
      "id": "f2460401-8211-5f91-bbcf-2298139dd480",
      "language_capabilities": [
        "ru"
      ],
      "qualifications": [
        "passenger",
        "accessibility"
      ],
      "shift_end": 720,
      "shift_start": 0
    }
  ],
  "passengers": [
    {
      "accessibility_requirements": {
        "companion_count": 0,
        "needs_boarding_assistance": false,
        "needs_lift": false,
        "needs_ramp": false,
        "wheelchair_type": "NONE"
      },
      "companion_count": 0,
      "data_provenance": "synthetic",
      "eligibility_class": "STANDARD",
      "medical_priority": false,
      "privacy_class": "PUBLIC_SYNTHETIC",
      "pseudonymous_id": "0cad8b0a-80cd-5f6c-90e9-ae1cba8c0ad9",
      "wheelchair_type": "NONE"
    },
    {
      "accessibility_requirements": {
        "companion_count": 0,
        "needs_boarding_assistance": false,
        "needs_lift": false,
        "needs_ramp": true,
        "wheelchair_type": "MANUAL"
      },
      "companion_count": 0,
      "data_provenance": "synthetic",
      "eligibility_class": "STANDARD",
      "medical_priority": false,
      "privacy_class": "PUBLIC_SYNTHETIC",
      "pseudonymous_id": "1ad32eea-d4aa-5f03-affe-7b68306096f6",
      "wheelchair_type": "MANUAL"
    },
    {
      "accessibility_requirements": {
        "companion_count": 0,
        "needs_boarding_assistance": false,
        "needs_lift": false,
        "needs_ramp": false,
        "wheelchair_type": "NONE"
      },
      "companion_count": 0,
      "data_provenance": "synthetic",
      "eligibility_class": "STANDARD",
      "medical_priority": false,
      "privacy_class": "PUBLIC_SYNTHETIC",
      "pseudonymous_id": "25875d98-aabf-56ea-98f3-82e77074b2c9",
      "wheelchair_type": "NONE"
    },
    {
      "accessibility_requirements": {
        "companion_count": 0,
        "needs_boarding_assistance": false,
        "needs_lift": false,
        "needs_ramp": false,
        "wheelchair_type": "NONE"
      },
      "companion_count": 0,
      "data_provenance": "synthetic",
      "eligibility_class": "MEDICAL",
      "medical_priority": true,
      "privacy_class": "PUBLIC_SYNTHETIC",
      "pseudonymous_id": "32b7ae60-0a46-5d0c-96c9-3cae80edcd9a",
      "wheelchair_type": "NONE"
    },
    {
      "accessibility_requirements": {
        "companion_count": 0,
        "needs_boarding_assistance": false,
        "needs_lift": false,
        "needs_ramp": false,
        "wheelchair_type": "NONE"
      },
      "companion_count": 0,
      "data_provenance": "synthetic",
      "eligibility_class": "STANDARD",
      "medical_priority": false,
      "privacy_class": "PUBLIC_SYNTHETIC",
      "pseudonymous_id": "3c7f8241-0ad1-56f8-8d2f-14ff9c7130c6",
      "wheelchair_type": "NONE"
    },
    {
      "accessibility_requirements": {
        "companion_count": 0,
        "needs_boarding_assistance": false,
        "needs_lift": false,
        "needs_ramp": true,
        "wheelchair_type": "MANUAL"
      },
      "companion_count": 0,
      "data_provenance": "synthetic",
      "eligibility_class": "STANDARD",
      "medical_priority": false,
      "privacy_class": "PUBLIC_SYNTHETIC",
      "pseudonymous_id": "4ce8e0a7-25f4-560a-9fca-4437f79edb31",
      "wheelchair_type": "MANUAL"
    },
    {
      "accessibility_requirements": {
        "companion_count": 0,
        "needs_boarding_assistance": false,
        "needs_lift": false,
        "needs_ramp": false,
        "wheelchair_type": "NONE"
      },
      "companion_count": 0,
      "data_provenance": "synthetic",
      "eligibility_class": "CHILD",
      "medical_priority": false,
      "privacy_class": "PUBLIC_SYNTHETIC",
      "pseudonymous_id": "546625e2-85a7-5f1b-bcb1-d24ecaa0df6f",
      "wheelchair_type": "NONE"
    },
    {
      "accessibility_requirements": {
        "companion_count": 0,
        "needs_boarding_assistance": false,
        "needs_lift": false,
        "needs_ramp": false,
        "wheelchair_type": "NONE"
      },
      "companion_count": 0,
      "data_provenance": "synthetic",
      "eligibility_class": "STANDARD",
      "medical_priority": false,
      "privacy_class": "PUBLIC_SYNTHETIC",
      "pseudonymous_id": "5c4c83e1-f5c2-5472-9c0a-4514a1ffc66f",
      "wheelchair_type": "NONE"
    },
    {
      "accessibility_requirements": {
        "companion_count": 1,
        "needs_boarding_assistance": false,
        "needs_lift": true,
        "needs_ramp": false,
        "wheelchair_type": "MANUAL"
      },
      "companion_count": 1,
      "data_provenance": "synthetic",
      "eligibility_class": "CHILD",
      "medical_priority": true,
      "privacy_class": "PUBLIC_SYNTHETIC",
      "pseudonymous_id": "66b4afc7-2e9f-5fd1-81eb-3891b9226a88",
      "wheelchair_type": "MANUAL"
    },
    {
      "accessibility_requirements": {
        "companion_count": 1,
        "needs_boarding_assistance": false,
        "needs_lift": false,
        "needs_ramp": false,
        "wheelchair_type": "NONE"
      },
      "companion_count": 1,
      "data_provenance": "synthetic",
      "eligibility_class": "STANDARD",
      "medical_priority": false,
      "privacy_class": "PUBLIC_SYNTHETIC",
      "pseudonymous_id": "7de36d8e-6b72-504f-92e8-24e1f51bf546",
      "wheelchair_type": "NONE"
    },
    {
      "accessibility_requirements": {
        "companion_count": 0,
        "needs_boarding_assistance": false,
        "needs_lift": false,
        "needs_ramp": false,
        "wheelchair_type": "NONE"
      },
      "companion_count": 0,
      "data_provenance": "synthetic",
      "eligibility_class": "STANDARD",
      "medical_priority": false,
      "privacy_class": "PUBLIC_SYNTHETIC",
      "pseudonymous_id": "8ebe570e-396f-561b-956f-c0d44269d6b5",
      "wheelchair_type": "NONE"
    },
    {
      "accessibility_requirements": {
        "companion_count": 0,
        "needs_boarding_assistance": false,
        "needs_lift": false,
        "needs_ramp": false,
        "wheelchair_type": "NONE"
      },
      "companion_count": 0,
      "data_provenance": "synthetic",
      "eligibility_class": "STANDARD",
      "medical_priority": false,
      "privacy_class": "PUBLIC_SYNTHETIC",
      "pseudonymous_id": "8f9166fe-1e3b-5d01-ae5e-f69f1d7a56a3",
      "wheelchair_type": "NONE"
    },
    {
      "accessibility_requirements": {
        "companion_count": 0,
        "needs_boarding_assistance": false,
        "needs_lift": true,
        "needs_ramp": false,
        "wheelchair_type": "MANUAL"
      },
      "companion_count": 0,
      "data_provenance": "synthetic",
      "eligibility_class": "STANDARD",
      "medical_priority": false,
      "privacy_class": "PUBLIC_SYNTHETIC",
      "pseudonymous_id": "a3ebc219-2f5c-54a1-8d8a-af96fb22d89a",
      "wheelchair_type": "MANUAL"
    },
    {
      "accessibility_requirements": {
        "companion_count": 0,
        "needs_boarding_assistance": false,
        "needs_lift": false,
        "needs_ramp": false,
        "wheelchair_type": "NONE"
      },
      "companion_count": 0,
      "data_provenance": "synthetic",
      "eligibility_class": "STANDARD",
      "medical_priority": false,
      "privacy_class": "PUBLIC_SYNTHETIC",
      "pseudonymous_id": "b25a932c-f5b4-5381-9dbd-ed82bb2f32d6",
      "wheelchair_type": "NONE"
    },
    {
      "accessibility_requirements": {
        "companion_count": 0,
        "needs_boarding_assistance": false,
        "needs_lift": false,
        "needs_ramp": false,
        "wheelchair_type": "NONE"
      },
      "companion_count": 0,
      "data_provenance": "synthetic",
      "eligibility_class": "STANDARD",
      "medical_priority": false,
      "privacy_class": "PUBLIC_SYNTHETIC",
      "pseudonymous_id": "b36ada6b-07c9-5998-b35f-309a8614d1b0",
      "wheelchair_type": "NONE"
    },
    {
      "accessibility_requirements": {
        "companion_count": 1,
        "needs_boarding_assistance": false,
        "needs_lift": false,
        "needs_ramp": false,
        "wheelchair_type": "NONE"
      },
      "companion_count": 1,
      "data_provenance": "synthetic",
      "eligibility_class": "STANDARD",
      "medical_priority": false,
      "privacy_class": "PUBLIC_SYNTHETIC",
      "pseudonymous_id": "bcd39c8a-e43a-55ab-8409-f67727a5a993",
      "wheelchair_type": "NONE"
    },
    {
      "accessibility_requirements": {
        "companion_count": 0,